Movie Name;Overall_Rating;Review_Title;Review_Date;Review_Text;Recommend 
Mamma Mia! (2008);6;Pales in comparison to the stage production;07.08.2008;"I have seen Mama Mia twice on stage, and it is one of my favorite musicals, so I could barely wait to get to the theater to see it as a full feature film. Unfortunately, the movie was quite disappointing to say the least. I felt the casting of the characters was weak and poorly represented the characters as originally written. Donna was always portrayed as spunky and attractive though overworked and exhausted, and Meryl Streep just didn't have that ""umph"" to her. Pierce Brosnan had the look of Sam, but his singing was terrible. When adapting a musical to the big screen, quality of singing voice should be given more consideration. There are so many amazing actors with phenomenal voices, I can't understand why they didn't cast a little more carefully. There were also songs from the stage production that were not included in the movie including my favorite, ""Thank you for the Music"". I kept waiting for it to be thrown in somewhere along the way, but it was not included at all. While I wouldn't say the movie was terrible, I think if you have seen it live on stage, prepare to be disappointed.";no
Mamma Mia! (2008);10;"""Mamma Mia!"" Says (Sings) It ALL!";19.08.2008;"""Mamma Mia!"" radiates rainbows of infectious energy, in part owing to its array of ABBA songs. The champagne frothy, transcendental music of ABBA imbues this innocuous movie with lighter-than-helium buoyancy. Indeed, audiences could literally dance in the aisles for the movie seems like a concert with a plot. Director Phyllida Lloyd keeps those few quiet, introspective moments of intimacy to a minimum. Although ""Mamma Mia"" is a chick flick, it is neither a heartbreaker nor a tearjerker. Nobody dies from a sudden bout of cancer. Furthermore, this madcap comedy of errors doesn't have a dull moment. Meryl Streep, Pierce Brosnan, Colin Firth, Stellan Skarsgård, Julie Walters, and Christine Baranski must have been dosed up with Ritalin. Rarely do they sit around and talk. They are dancing, singing, and cavorting about a scenic Greek island, and they look like that had a terrific time. What makes ""Mamma Mia!"" so enjoyable is the elaborate way that the ABBA tunes have been worked in to compliment the film's themes. The cast, especially 59-year old Streep, does a great job of belting out chartbusters like ""Super Trouper,"" ""Dancing Queen,"" ""Knowing Me, Knowing You,"" ""Thank You for the Music,"" ""Money, Money, Money,"" ""The Winner Takes It All,"" ""Voulez Vous,"" ""I Have a Dream,"" and ""SOS."" Moreover, the resolution to the mystery of Sophie's dad and the surprises that occur as a result will keep you guessing. If you missed taking a summer vacation, you can take a chance on ""Mamma Mia!"" The lush Greek scenery, the entertaining storyline, and the enchanting performances will transport you out of the doldrums.";yes
Mamma Mia! (2008);7;fun feel good movie;19.08.2008;Besides being visually pleasing...the cast was superb. Meryl streep is such an amazing actress, so diverse and never disappointing. Colin firth as the 'spontaneous' hippie is hilarious. and pierce Bronson is fabulously handsome and romantic . the music was also great fun, made me feel like i was watching a bollywood movie.;yes
Mamma Mia! (2008);10;Simply amazing!;12.09.2008;"Well, what can i say? This movie is one of the best movies i've seen in on a big screen so far! I don't particularly like musicals, but man this one is awesome! All the songs that have been chosen for it are great and popular so it was no surprise that all the time the audience was singing along with the actors :) The whole time the faces of the people around me were lightened up with a smile and everyone was happy! Me..... i had the chills going down my spine pretty much most of the time :) No one stood up before the final credits were shown and everybody was simply sitting down listening to the music, happy by the unexpected joy this movie brought them ;) I strongly recommend this piece to everyone regardless of age and genre preferences, cause i really believe that this movie is so good that there's no way not to fall in love with it! :)";yes
Mamma Mia! (2008);9;Feel Good Movie of the Year;16.09.2008;This movie is great fun and I can't believe all the people and critics complaining about the lame plot and lack of character development, This is Mama Mia what the heck. It's fast paced and fun. Highly recommended.;yes
Mamma Mia! (2008);10;Frivolous fun!;26.09.2008;Okay, so here we have an entirely implausible storyline shaped into unashamedly enjoyable cinema experience. Personally, I hate going to movies, just because they are so expensive these days. I went to see this one twice... People in the audience were laughing out loud, clapping and enjoying themselves. Isn't that what we go to the movies for, to be entertained? Admittedly, Pierce Brosnan can't sing... so what? He was a ton of fun. The leading ladies (Streep, Walters and Baranski) seemed to be having such a good time... there is not much sexier than mature women having fun and being the mature women they are... The characters looked and acted seasoned, which was quite refreshing.;yes
Mamma Mia! (2008);10;"Breath Taking

";29.09.2008;I can't stop singing the musics and remembering the scenes.;yes
Mamma Mia! (2008);7;Aren't the actors too old?;05.10.2008;It really was a wonderful movie. I enjoyed it thoroughly. Great cast, and I loved the musical selections. I sang along and knew most of the words. Amanda Seyfried was just lovely, and very talented.;yes
Mamma Mia! (2008);9;Wonderful nostalgia;07.10.2008;It's so amazing to see the chemistry between Meryl Streep and Pierce Brosnan, her performance as Donna is so cool, cheerful, full of life and also touching but not overwhelming, she raised her daughter Sophy as a single mom struggling with financial issues but never lose faith and optimism managing a small resort place somewhere in the mystic Greece. I enjoyed to watch this movie with one of my best friends, both of us are married and have family, we shared a little space of time for going to the movies and have a good time with Mamma Mia, we sang, we laughed and we also remembered wonderful times with those timeless songs of Abba. Excellent choice with Meryl Streep, I can't imagine this film without her and Pierce Brosnan was surprising when he sang.;yes
Mamma Mia! (2008);8;Fun! Fun! Fun!;09.10.2008;"I get a kick out of all the people that come on this board to bash this movie when clearly they don't like musicals by their own admission. That would be like me critiquing a horror film - I despise horror films so it would be hard for me to find anything redeeming about one. So why people insist on seeing a film in a genre that they knowingly do not like or appreciate, and then proceed to criticize it, is beyond me! Anyway, regarding the movie - Here's the good: 1) The location and cinematography - absolutely breathtaking! It makes a person want to seriously consider Greece as their next vacation destination. I'm sure the Board of Tourism in Greece couldn't be happier with this film. 2) Singing talent - while many have roundly criticized the choices for the leads in this film, I find the fact that Meryl Streep and Pierce Brosnan and a few others aren't trained singers rather endearing. In fact, I found Meryl Streep's rendition of ""Slipping Through My Fingers"" more emotional than any stage version I've seen and even the original song. And to improve upon Agnetha Faltskog's voice/version is a tall order indeed! The young actor/singer who plays Sophie (Amanda Seyfried) is beautiful and has a lovely, angelic voice. Visually, she is a believable casting choice to play Meryl Streep's daughter and I thought they had good on-screen mother-daughter chemistry. 3) The Plot - Yes, it's thin and silly and frothy, but that's what makes it so fun! I mean, think about it. Any time you watch a musical, you have to suspend disbelief. When in real life does anyone ever belt out a song and dance in the middle of a conversation (with backup singers to boot)? And besides, who amongst any of this film's viewers doesn't know and understand the fact that this plot was created from stringing a number of unrelated ABBA tunes together? Since the process of matching music to the plot is reversed from the normal way, I'm amazed that they were able to create as cohesive a story as they did. 4) The dancing bachelor party boys - Yea! the film left the flipper-flaunting boys (from the stage version) in the scene for ""Lay All Your Love on Me"". I looked around the theater when the boys first appeared and I couldn't find a single person who was not laughing or at least grinning from ear to ear!";yes
Mamma Mia! (2008);10;My, My What A Movie!!!;10.10.2008;Being such a huge ABBA fan, I went with my WHOLE family - there were 13 of us (plus kids) and we all had a really good time.;yes
Mamma Mia! (2008);1;Mamma Mia is trivial, superficial and left me numb.;24.10.2008;I cannot remember a more trivial, mind numbing and shallow film in other words a real chick flick of the worst kind. How can anyone watch this film and recommend it to others ? Only if they don't like admitting they made a mistake. It seems to summarise the worst of female aspirations. No real substance to it all happy and shallow. Yeah that'll please the masses. Well not this member of the masses. What a trivial load of drivel. I wanted to leave the cinema within 5 minutes of the start. And to think I paid £7 to see this ! I think this does however represent the dumbing down of cinema as with most media these days. So I like a bit of reality in my musicals call me sad or what ?;no
Mamma Mia! (2008);9;You will need Onomatopoeia to describe the Euphoria of this movie;26.10.2008;"Those Doodley-Doodley-Do, Dippy-ti-Dippy-ti-Du melodies, combined with a Humpty-Dumpty tiny precious lyrics, made my brain wonder ""Uh-Huh"" in surprise, and my lips to mutter ""Oh-WOW"" in amazement until my mouth burst in ""Ah - Hah - Ha-Ha-Ha"" happy girlie giggle. That's when my heart started going Rum-Tum-Tum along the bas-line, my pulse started jumping Bum-Bum-Bum in the tact with the disco rhythm, my skin started itch-itch-itching from those pulsations, my stomach started hush-hush-hushing down the noisy butterflies but it couldn't stop my soul from screaming ""Hip-Hip-Hooray"" and ""Yippie-Yippie-YEAH"" from the immense joy and pleasure! Simply amazing...";yes
Mamma Mia! (2008);7;Just like ABBA's music, you'll either really like or just hate this movie.;02.11.2008;Right after having seen this movie I still feel like I could go either way on it. I could completely pick this movie apart and blast it for its silly story, weak directing and whatever more but truth is that this movie is simply harmless fun, that you can either hate on or just surrender yourself to.;yes
Mamma Mia! (2008);9;Incredible, unexpected;14.11.2008;"What a wonderful film. I can't write in English all the feelings that this film makes me feel. I don't know who's the responsible of the excellence: the writer (Bill Goldman agrees that) the director, the actors, the music, the production designer... but don't matter. The film makes me laugh, cry, feel, sing, dance... and think. I believe that to make a musical film with a high percent of time singing and dancing is not an easy job in the time of our days. Endue a continuity, a story, to a collection of independent and existing songs seems to me an incredible ""tour de force"". And the filmmakers achieve this with success. I know that this kind of film can't be ""Citizen Kane""... Or yes?";yes
Mamma Mia! (2008);10;One Hell of a Trip Down the Aisle.......;20.11.2008;Think of an amusement park or fairground ride, that catches your attention, and draws you to it. You get on, the ride starts, the excitement builds, and off you go. It holds you entranced, the rush is incredible! Then suddenly you realize that it has finished, time to get off. Really, you have only one choice: to get back on it again. That pretty much sums up Mamma Mia! Despite all the hype, I was not disappointed-no way! Forget any negative comments you might have heard about Pierce Brosnan's singing ability. THe more you watch, the better he gets, (an acquired taste, perhaps!) I have one recommendation though: See it on a big screen.;yes
Mamma Mia! (2008);7;Love, music & a good story conquer all;09.12.2008;First and most importantly: Those ABBA people are great songwriters. The storyline is compelling, good-feeling and tugs on the right heartstrings…enough to overcome the disappointments which mostly involve the casting of well-known and well-loved but non-musical performers in musical roles. Further casting issues: actors who are older than the parts they are playing and a lack of chemistry which kept me from believing the story.;yes
Mamma Mia! (2008);7;Mamma Mia!;13.12.2008;"Although ""Mamma Mia!"" is full with many imperfections, it brings so much happiness that you get out from the cinema desiring to dance and sing the tunes you've just listened during the film, and I think this is a very positive aspect in these trying times. Abba's songs are crystalline and joyous, and they still maintain their potential also in this film, in which, let's admit it, not everybody can sing (Pierce Brosnan wasn't born to sing, and even Meryl Streep hasn't an unforgettable voice, but the newcomer Amanda Seyfried is quite OK according to me). All in all, the best things in this film are: the character of Tanya (Christine Baranski is so funny!), the ""Dancing Queen"" scene with that fantastic choreography, and the paradise island setting of this story.";yes
Mamma Mia! (2008);7;Surprisingly Good;16.12.2008;"Mamma Mia is not your typical ""female"" movie. It is a nice, refreshing film that is a lot of fun to watch. It does not have the typical female movie aspects of two horrible characters you cannot stand (As Good As It Gets) or two characters who despise each other yet somehow get together (Message in a Bottle)--it is an old time romantic musical that intelligently brings the aspects of Abba's music into the storyline. The characters are portrayed very well, though a few of them are not the greatest singers. The storyline is well thought out and written. The direction is well paced and nicely done. The scenery is gorgeous and adds to the story. It is an overall nice film that you can sit down with the family and watch.";yes
Mamma Mia! (2008);6;Should have been a lot better;31.12.2008;I love Abba's music, and looked forward to this movie - what a let down! The movie makers here were just out to make a fast buck, and don't have a single clue as to the reason for Abba's popularity.;yes
Mamma Mia! (2008);1;My my how can I resist it? Quite easily actually....;31.12.2008;"Of course objective criticism is a bit of a waste of time as those of us who think that good Cinema should at least be about films having a decent plot, well cast actors and decent production and direction may soon be in a minority. Those of us who suggest that on the evidence of the success of Mamma Mia that it is final proof of the maxim that nobody ever went broke underestimating the taste of the public are likely to be seen as elitist killjoys. Well so be it – I'm not going to dilute my crucial faculties just because the public votes with its feet and its money to crown Mamma Mia as worthwhile entertainment. Never mind the quality feel the width of the box office takings! But, for what its worth – and that's probably not much, here is a brief list of the reasons why Mamma Mia is such excreta. The plot is trivial, unbelievable, ill-constructed, offensive and just plain dull. The casting is dire. True Meryl Streep is wonderful – but when has she ever not been? But Pierce Brosnan and Colin Firth are wooden throughout and they can't sing – and no this is not irony or even remotely funny. It's a MUSICAL. The leads must be able to sing. Doh! Amanda Seyfried can sing and she's very pretty too. But what about those bloody teeth? Sorry this may be a bit from left field but why would a nice little 20 year-old have to have shining white and 100% artificial looking brilliant white teeth. It made her look like an American Ryder Cup wife for goodness sake! Stellan Skarsgard (who?) was dull and he couldn't sing either. Julie Waters gave us one of her batty old ladies – we've seen it before Jules and it made no sense in Mamma bloody Mia. Christine Baranski was good – almost in the Streep class but surely a film with this budget could have cast all of the principals rather more thoughtfully? The editing was woeful as well. There seemed to be a good few gaffes that should have been edited out and reshot – did nobody care or not think that we'd notice when an actor forgets their lines? And was that set meant to look realistic – or the extras look like real people? Maybe not. And maybe on stage it wouldn't matter. But it wasn't on stage – it's a movie! Musical Theatre only really transfers well to film when it is opened out. Think ""Sound of Music"" or ""Carousel"" or ""My Fair Lady"". Mamma Mia was claustrophobic despite the stock shots of the Aegean. It looked more like Pinewood. It was Pinewood! OK so ABBA write catchy songs and we all like occasionally to hum along with them. But why put them into a stage show with a supposed plot in the first place. Why not just perform them as song and dance in concert? And if you must try and make a facile piece of drama around a random collection of songs and put it on stage then please don't later think that it will make a film. But you have – and a few rich people have become even richer as a result. And the Cinema is the poorer for it.";no
Mamma Mia! (2008);1;Sorry but where have all your critical faculties gone?;02.01.2009;Having avoided seeing the movie in the cinema, but buying the DVD for my wife for Xmas, I had to watch it. I did not expect much, which usually means I get more than I bargained for. But 'Mamma Mia' - utter, utter cr**. I like ABBA, I like the songs, I have the old LPs. But this film is just terrible. The stage show looks like a bit of a musical, but this races along with songs hurriedly following one another, no characterisation, the dance numbers (which were heavily choreographed according to the extras on the DVD) are just thrown away with only half the bodies ever on screen, the dance chorus of north Europeans appear on a small Greek island at will, while the set and set up of numbers would have disgraced Cliff Richard's musicals in the sixties!Meryl (see me I'm acting)Streep can't even make her usual mugging effective in an over-the-top musical! Her grand piece - 'The Winner Takes It All' - is Meryl at the Met! Note to director - it should have been shot in stillness with the camera gradually showing distance growing between Streep and Brosnan! Some of the singing is awful karaoke on amateur night. The camera cannot stop moving like bad MTV. One can never settle down and just enjoy the music, enthusiasm and characters. But what is even worse is how this botched piece of excre**** has become the highest grossing film in the UK and the best selling DVD to boot? Blair, Campbell and New Labour really have reduced the UK to zombies - critical faculties anyone???;no
Mamma Mia! (2008);1;Evil.;05.01.2009;"I honestly cannot stress enough how evil and awful this pitiful excuse for a film is. Absolutely none of the actors can sing so it feel like your eardrums are being attacked by a cheese grater. I may sound like I'm exaggerating, and I wish I was, but this movie really is painfully bad. Even if you love musicals, avoid this picture like the plague. I would actually recommend you staple your ear to a donkey as it would probably be less painful. Please, please; for your own sake, save your ears the torture and watch 'The Dark Knight' instead.";no
Mamma Mia! (2008);7;Could be better, but not a total failure either;16.01.2009;I have heard several people refer to it as a 'girly' piece, and I, for the most part, agree. There seems to be two main characters and their respective story lines: a mother worrying about her daughters wedding and about the three guests, all of whom might be the father (it's a bit hard to explain), and the daughter trying to find out about her father. The mother has two friends (rather well played) who help her out in these situations while engaging in casual fun of their own while staying on the mother's island.;yes
Mamma Mia! (2008);1;A Stinker of a Movie;23.01.2009;This is the worst movie I have seen in the last five years. If you think ugly Americans stinking it up in a foreign country is bad, you should see these Brits ruining a picturesque little slice of Greece. Everybody acts like they're drunk and having a grand old time-- it's excruciating to watch. Nobody can sing. Meryl Streep has done somber, depressed roles in the past that are really good, but she is just terrible in this movie. I hope this doesn't mean she has lost her ability to pick good roles for herself. This movie felt like the actors got on board because they thought it would be great fun to have a party in Greece, but they forgot they had to make a movie.;no
Mamma Mia! (2008);7;It's NOT The Sound of Music, That's for Sure!;10.02.2009;Call me silly, but The Sound of Music is still my favorite musical and the film by which I judge all musicals and Mama Mia sure comes up short. All I kept thinking during the movie was why Julie Andrews wasn't the female lead? Meryl Streep? I LOVE Meryl Streep, but not in Mama Mia! She is the miscast of the year in this role and she CANNOT sing! Nor can Pierce Bronsan or anyone else for that matter except the two young leads who are both knock-outs - both to look at and to listen to. Colin Firth, my very favorite male lead, was the only singer who moved me to tears and he can't sing either. I kept thinking why have they made a musical without singers? What am I missing? But there's so much about this film that annoyed me. First of all, the story is the least romantic I have ever come across. The idea that a young woman on the day of her wedding wants the three men her mother hooked up with and one of whom may be her father is not only silly, it's just plain neurotic, hardly the basis for a romantic story. Okay, so the location shooting was fabulous, but the actors paled in comparison, all of them looking terrible except for the two young leads who looked fantastic! Merly Streep especially looked positively gruesome. All I kept thinking was that the director must HATE Meryl Streep to have her photographed so poorly. But the men didn't look any better especially Pierce Bronsan. The choreography was incredible, no doubt about it, but there were way too many songs and entirely too much motion - everyone on Earth got into the act every time there was a song to be sung - people coming from every direction so that it looked like the entire world was dancing, which might not be such a bad idea, but NOT in a movie, especially when you're trying to follow what little there is of the story.;yes
Mamma Mia! (2008);1;Weak Script, Shallow Characters - Just Abysmal;08.03.2009;"Unlike ""Grease"" or ""Chicago"", the characters are not fully developed and are left with little or no substance. The tale itself is just as shallow, dotted with story lines that virtually spring up out of nowhere to bring about its end. Maybe if the characters didn't burst into song every few seconds, we'd get to know them and a true, definitive story would be allowed to develop.";no
Mamma Mia! (2008);4;Don't believe the hype;17.03.2009;Really, don't believe the hype. This film is really a major disappointment. I wasn't particularly looking forward to it but was prepared to be pleasantly surprised. Unfortunately my scepticism was entirely justified. What on earth was Meryl Streep thinking of? To say nothing of Colin Firth, Pierce Brosnan, Stellan Skarsgaerd and Julie Walters.;no
Mamma Mia! (2008);2;Are you kidding me?;20.03.2009;Sadly, this movie is a huge disappointment. I'm searching for the right words without being too critical, but frankly, they don't exist. No plot, no (singing) talent, and no satisfactory ending. Hard to believe Meryl Street, Pierce Brosnan, and Colin Firth stooped to this level. Without them the movie would have been laughed out of Hollywood;no
Mamma Mia! (2008);7;Good Songs!;14.07.2009;I'd definitely give this ten out of ten for the songs but I feel that the storyline wasn't very good at all! Julie Walters is hilarious in this but i feel that the film has but a bad reputation to both Abba and their songs. I also fail to recognise why Colin Firth was gay. What was the point? Furthermore I think that wasn't that a waste of a good actor? I did love the setting though - the Greek Island took my heart away. The beach looked gorgeous and it looked incredibly warm. I have nothing against the actors I thought they were all amazing, their voices were great I just think that comparing such great songs to quite a rubbish story failed to impress me!;yes
