Movie Name;Overall_Rating;Review_Title;Review_Date;Review_Text;Recommend 
Mamma Mia! (2008);8;Surprisingly Infectious Fun;14.01.2008;"Abba's music never did much for me as pop songs, but in the context of a musical, they work quite well. There are a couple numbers I think could have been left out, specifically Baranski's ""Does Your Mother Know"" and Streep and Brosnan's ""Winner Takes It All"", but even those weren't bad. The singing is good pretty much across the board. Even the weakest singer, Pierce Brosnan, did a surprisingly good job. His voice has a certain Peter Gabriel quality to it (with a dash of Randy Newman).";yes
Mamma Mia! (2008);9;It Was Brilliant Feel Good Musical At Its Best!!;01.07.2008;I absolutely loved the screen adaptation of Mamma Mia! The look of it was gorgeous, never has a Greek island looked so beautiful! I loved Meryl Streep as Donna, she cam across as an honest and good-hearted character. I loved Amanda ans Sophie and my only big casting problem was Pierce Brosnan, you may want to cover your ears when he sings, he's horrible. Some of the songs seemed a bit forced in the storyline, but some of them felt at home. I saw an advanced screening and the sound wasn't very good but that could have been because of the spot where we were sitting. The movie was ultimate feel good! I loved it! It was very bright and bouncy the whole time. I didn't feel that there was one slow moment in the movie! I think my favorite moment in the movie was definitely Dancing Queen. It was spectacular.;yes
Mamma Mia! (2008);6,5;A movie that will make you smile;02.07.2008;I loved this movie! It's so much fun, and it's impossible to watch it without smiling. The cast is amazing, and the music is fantastic. I would definitely recommend it to anyone who is looking for a feel-good movie.;yes
Mamma Mia! (2008);8;Feel good comedy we Greeks loved it!;05.07.2008;"Went to an open theater last night here in Athens-Greece and all the audience was laughing their hearts out! Who cares about showing a bit of grotesque concerning ""modern Greece,"" i wish the real Greece was as shown in Mamma Mia--all dancing and singing. Awesome! It might look a bit too much of a comedy, but that's the whole point. Just enjoy it,laugh your heart outs, don't' even think about criticizing it and just have a wonderful night with it. Entertaining at its best! When will you ever get a chance to travel to an ideal Greek island with Meryl Streep, Peter Brosnan, Julie Waters etc, all dancing and singing with super high comedy involved. No wannabes here, just chaotic entertainment!";yes
Mamma Mia! (2008);10;fell good movie;06.07.2008;just seen film at odeon Leicester sq real feel good film, Abba music is great (Im a queen Fan) all the audience loved the film dancing and singing along, just like the stage show but better the Greek island setting was great good atmosphere I longed for mythos beer Meryl was good, pierce was good Julie was great take my advice take the wife and just enjoy the film, sit back kick off the shoes and soak up the sun and songs, the story is good not great but it carries the plot along at a good level of enjoyment, the actors seem to enjoy the singing and it was great to see non singing stars sing, I love the Greek islands and this made me want to go back and take ABBA on my ipod to enjoy on the beach and at the bar, all I want now is for We will rock you to come to the screen then my life would be complete.;yes
Mamma Mia! (2008);8;Take a Chance... It's Surprisingly Brilliant!;08.07.2008;While the majority of the film is brilliantly silly, Meryl Streep gives us an emotional show stopping performance of 'The Winner Takes It All. Who wouldn't pay to see James Bond singing 'SOS'? Pierce Brosnan was humorously over-emoting everything but it worked perfectly within the context of the film.;yes
Mamma Mia! (2008);6,5;Not for everyone;10.07.2008;I have to be honest, I didn't love this movie. I found the story to be a bit cheesy, and the acting was over-the-top. However, I can see why some people would enjoy it. If you're a fan of ABBA or musicals, then you'll probably like it.;yes
Mamma Mia! (2008);3;Mamma Mia - Chaotic and Absurd;10.07.2008;"""Mamma Mia"" was artificial and downright contrived – there was no flow with the story, the songs were hardly relevant to the situations, and the song numbers were so unnecessarily long (take ""The Winner Takes It All"" for instance.) There was hardly any conflict – just a lot of miscommunication. It was like a lengthy and overly-acted music video of sorts.";yes
Mamma Mia! (2008);10;Best Surprise of the Year!! (From a none Abba Fan!);12.07.2008;I went to see the film with my girlfriend and wasn't really interested, although it did have a very impressive cast! I LOVED it! What a great surprise, I laughed the whole way through and found myself completely invested in the plot!! The acting, singing and dancing was superb, I honestly believe Streep (who looked fantastic!) could be up for an Oscar.;yes
Mamma Mia! (2008);4;Cringeworthy;13.07.2008;It's quite a feat for the scenery to steal the show but that's what happens in this dreadful transfer from the stage to film. I tend to avoid musicals apart from the Gilbert and Sullivan type - deliberately tongue in cheek. However, I have a feeling Mamma Mia is a fine stage musical - it just doesn't work when straight actors take the main roles. The piece requires singers primarily as there is very little acting...a bit of dancing is called for but that is typical for a stage musical and there are plenty of performers who specialise in this genre. Streep and Walters are just so wooden it is unbelievable. Brosnan can't sing and Firth, what was he doing there? The daughter character comes over as a 13year old but is supposed to be 20 or so. So silly. This film represents a missed opportunity. The costumes are so much better than the dreadful stuff ABBA really wore, and the Greek island looks really enticing. Other than that there is nothing of merit.;yes
Mamma Mia! (2008);8;Big, loud, silly and wonderful;13.07.2008;"Mamma Mia!"" is brilliant. Really brilliant. Such a crowd pleaser. An exuberant, energetic, sparking musical, full of timeless songs and a cast (step forward Meryl Streep) who attack their roles with true gusto. Big, loud, silly and wonderful. As bright and camp as Graham Norton and Dale Winton on a night out. Look in any dictionary under the phrase 'Feelgood Movie' and you will see ""Mamma Mia!"" writ large. They should prescribe ""Mamma Mia!"" on the National Health. Fixes all known ills.";yes
Mamma Mia! (2008);7;It's hard not to be drawn in by this film!!;16.07.2008;I heard a cynical reviewer give Mamma Mia a good review and I was intrigued to see whether the film could work the same trick on me. This is the sort of film that I'd generally hate. I'm really into intelligent films that make the viewer think. You couldn't get a film that's further from this genre than Mamma Mia. The plot consists of a soon to be bride trying to work out who is her father from three possible candidates that she discovers from her mothers diary. She invites all three to the wedding in order to find out who her father is. That's it in terms of plot.;yes
Mamma Mia! (2008);7;Fun and joy-able!;18.07.2008;"When I went to see this movie a week ago, I soon noticed that a majority of the audience were people who most likely listened to ABBA as youngsters. I didn't. I'm a fan of musicals, ever since I saw Moulin Rouge, but just a few minutes into ""Mamma Mia"" I wondered if this really was my scene? Wasn't this kind of silly? But after 15 minutes I was convinced: This wasn't any air headed, dumb musical for a middle aged pop-music-loving audience - this was a super cute, funny and joy-able musical for everyone. My boyfriend, which i dragged to the theater because he claimed he hated Abba, laughed out loud and so did I and the rest of the audience.";yes
Mamma Mia! (2008);7;"It's not the play; get over it and you'll enjoy it.";18.07.2008;"To enjoy this film, it helps to leave some expectations at the door. One is that ""ABBA sound."" This isn't it. That sound was created in a studio with a mixing board, etc. Some of that sound was in the stage play and it worked there because the majority of the audience is far enough from the stage to really think that gorgeous sound is coming from just the cast on stage. But when the camera is right in the actor's face, and that face is several stories high, the music must come from the singer.";yes
Mamma Mia! (2008);7;Fun and joy-able!;18.07.2008;"When I went to see this movie a week ago, I soon noticed that a majority of the audience were people who most likely listened to ABBA as youngsters. I didn't. I'm a fan of musicals, ever since I saw Moulin Rouge, but just a few minutes into ""Mamma Mia"" I wondered if this really was my scene? Wasn't this kind of silly? But after 15 minutes I was convinced: This wasn't any air headed, dumb musical for a middle aged pop-music-loving audience - this was a super cute, funny and joy-able musical for everyone. My boyfriend, which i dragged to the theater because he claimed he hated Abba, laughed out loud and so did I and the rest of the audience.";yes
Mamma Mia! (2008);10;Amazing acting, breathe-taking places. Great Singing. Brilliant all round;18.07.2008;"The film was in my opinion Amazing. The actors & actresses acted their roles so well & obviously put a lot of emotion and hard work into the film. The music was brilliant, the singing amazed me! I had no idea to expect what i'd seen. Some scenes have you crying with laughter, others have you in floods of tears, because of the emotion & the lyrics of the songs.. I would definitely recommend you go out & watch this. As soon as it began, i was obsessed. I've been back twice to see it, and I'm planning to go again soon. The music will have you singing along, and seriously trying to resist the urge to stand up and dance. :)
";yes
Mamma Mia! (2008);10;Wonderful;19.07.2008;"I didn't know what to expect when going into watch ""Mamma Mia"", was this gonna be another Hairspray or Across the Universe or Rent? This was a lighthearted, quite enjoyable movie of its own style, Meryl Strep blew the entire audience away with her comedic persona in this movie. After seeing her in Devil Wears Prada, you are shaken momentarily after seeing her climb on top a roof singing ""Mamma Mia!"" and swoon and the dance teenage giddy girl dance. You'll love this movie for trio of older woman characters, they were all so funny. Mr. James Bond's character and singing was such a hilarious delight for the audience, we couldn't believe this was the man who played a top secret spy agent.";yes
Mamma Mia! (2008);1;Utterly dreadful;19.07.2008;"Let's get one thing out of the way first: I used to really like ABBA's music, some of the songs are recognised classics of pop and their place in pop history is assured, but this film (and the stage 'musical' by association) has savaged that legacy. This movie is so contrived, ridiculous, awfully plotted and embarrassing, it should never have seen the light of day; it makes Alvin and the Chipmunks look like high art.";no
Mamma Mia! (2008);7;Cotton candy no good for tummy but sometimes good for heart;19.07.2008;Well -- it wasn't glorious fun, but I left the theater smiling and humming the music. And that's despite Phyllida Lloyd's nearly catastrophic turn as director. Who the hell decided just because somebody's directed a play on a stage they know how to direct a movie? Her clumsiness came damn close to ruining the film...as did the editor, who really must have been on coke at the time or else has a major case of ADD. I think it works better for a musical if you can see the numbers come together as all of a piece and not four-thousand, three-hundred and fifty seven different pieces, like they do on music videos.;yes
Mamma Mia! (2008);6;Really fun and Worth the price of admission;19.07.2008;We really enjoyed this film because we are big fans of ABBA, Mamma Mia, Meryl Streep, Colin Firth, Julie Waters, Christine Baranski and Pierce Brosnan. The dancing and acting was top notch, but as expected the bride and groom, and MS Baranski were by far the best singers. No one really expected the rest of the cast to be professional singers. The older generation was a bit too old to fit the story line and it was probably a mistake to mention the internet in one scene and then show pictures of a hippy past in the next. But the beauty of Mamma Mia is that the quality of the music is such that the next door neighbors could perform it and the audience would still be dancing in the aisles.;yes
Mamma Mia! (2008);6;Super Pooper;20.07.2008;Let me tell you. Just because I've been listening to ABBA almost non-stop since I saw MAMMA MIA! two days ago does not mean I enjoyed the film all that much. It's just the Swedish pop super group's music is so darn infectious. You would think that energy would translate to feel-great good time at the movies but sadly this is not the case. First time feature filmmaker, Phyllida Lloyd, spends far too much time dragging her feet when they should be dancing up and down the beach and no matter how many shots of the moonlight shimmering against the waves there are, the film is still a clunker instead of a stunner.;yes
Mamma Mia! (2008);7;That Just Happened!;20.07.2008;I manned up when my better 1/2 asked to go see this. I didn't put up a fight or whine or make comments I just said sure. I have zero experience with musicals let alone the source material for Mamma Mia! I don't know what I witnessed exactly but im not kidding when I say that I haven't smiled that much for no good reason well ever! You would have to be a sadist to hate this movie. Every performance by the actors made me believe that they were having a ball. Its dumb fun & having seen The Dark Knight the night before im glad I didn't see them back to back! Im pretty sure I would have had an aneurysm. If you cant stand musicals you will hate Mamma Mia but if you don't care one way or another & are open minded do yourself a favor go see it.;yes
Mamma Mia! (2008);7;That Just Happened!;20.07.2008;I manned up when my better 1/2 asked to go see this. I didn't put up a fight or whine or make comments I just said sure. I have zero experience with musicals let alone the source material for Mamma Mia! I don't know what I witnessed exactly but im not kidding when I say that I haven't smiled that much for no good reason well ever! You would have to be a sadist to hate this movie. Every performance by the actors made me believe that they were having a ball. Its dumb fun & having seen The Dark Knight the night before im glad I didn't see them back to back! Im pretty sure I would have had an aneurysm. If you cant stand musicals you will hate Mamma Mia but if you don't care one way or another & are open minded do yourself a favor go see it.;yes
Mamma Mia! (2008);5;Serves it purpose;20.07.2008;"With musicals on stage coming out left, right and centre it was no surprise that they would start to put them back into film. With the recent Sweeney Todd film setting the standard for musicals, the Abba musical had a lot to live up to. To start with this was not going to be artful masterpiece that Tim Burton created, this was going to be a feel good movie that was designed to entertain. For this it works, however the story behind this film is quite simply terrible, and the singing isn't up to the standard of the likes of Chicago. Julie Walters and Meryl Streep steal the show completely, they're worth watching and Streep's version of ""The winner takes it all"" is stunning.";no
Mamma Mia! (2008);6;"Halfway through ""The Winner Takes it All"", my resistance finally died";20.07.2008;Don't get me wrong. This is a bad film. The plot is poor and badly carried out. Some of the songs are appalling. Pierce Brosnan cannot sing at all. Colin Firth struggles. Story lines pop out of nowhere. In short, it's badly written, badly directed and has some of the worst singing ever heard in a cinema.;yes
Mamma Mia! (2008);6;I love this movie with a love bordering on the unnatural;21.07.2008;"I have a confession to make that could land me in serious trouble here. I love this movie with a love bordering on the unnatural. Of course, I hear you saying, that can only mean one thing; you're a gay man of a certain age and if you haven't come out of the closet already, you're coming out now, and wearing sequins at the same time.";yes
Mamma Mia! (2008);7;It knows who it is aiming for and what it has to do;21.07.2008;"However for what it does Mamma Mia is actually very good because it knows who it is aiming for and what it has to do. Yes this means that it is daft and cheesy but that sort of ""big"" cheerfulness is what the target audience want – they want to feel elated and lifted even if it isn't real in any form. In that regard the film delivers as it is built on beautiful colours in the sets and costumes and a cast that put their egos to one side and throw themselves into it.";yes
Mamma Mia! (2008);5;It's definitely a cheesy movie and far from perfect;21.07.2008;It's definitely a cheesy movie and far from perfect, but it's a fun watch with catchy songs (duh, it's ABBA). It's not too long nor too short, so it's a perfect movie to watch when you just want to relax and not think too much.;no
Mamma Mia! (2008);10;True to what it promises: A First-rate Crowd Pleaser;22.07.2008;"So, let me put it that way: Mamma Mia! is one of the most entertaining pieces of cinema that I have seen in a long, long time. Yes, it doesn't have the gorgeous stylization of Moulin Rouge or the raunchiness of Chicago, but in its own way, it's just amazing. The simple presentation is backed up by a fantastic cast, a heartwarming story about love and the meaning of family, and a bunch of beautiful songs. Watching this film was one of the most beautiful movie-going experiences I had; I saw it 3 times in packed theatres, where audiences were quiet when they needed to be, and active and responsive otherwise. In those three times, the first Dancing Queen number got wild applause by the minute it was over, a proof of the entertainment value of the film. And near the end, when Donna looks at the screen and asks why everyone is still there while the credits are rolling, she says ""do you want one more song?"" and the entire audience would scream ""YEAH"". This is a first-rate crowd pleaser; a film that takes you into its world until you feel you are part of it. What an achievement.";yes
Mamma Mia! (2008);8;I don't like musical movies at all, but I have to admit that this movie was good !;22.07.2008;What made the movie enjoyable for me were the music, the visuals, and, surprising to me, Meryl Streep. I usually don't like Streep's movies or her performances. Her films tend to contain subject matter I don't care for, and, often, they are preachy in a way that I find disagreeable. The tendency to underplay a role is normally a desirable quality in an actor. Unfortunately, she underplays to barbiturate levels.;yes
Mamma Mia! (2008);2;The cinematic equivalent of water boarding;24.07.2008;It was a silly juke box musical on stage, now it's a big, splashy, poorly shot screen juke box musical. If you like ABBA, so-so. If not, an assault on the senses and an insult to whatever intelligence you're left with when you exit the theater. I readily admit that I didn't really want to see this movie and went with some friends who did, but for the love of God. Why does my gender shriek and squeal to convey delight? Ever sit next to a table of women who have had too much to drink and are absolutely determined to have GREAT night out on the town? That's the feeling of this whole project. It just felt so good when it stopped.;no
Mamma Mia! (2008);8;A Joy From Start To Finish!;24.07.2008;However, i left my cinema with a sense of joy at what i had witnessed, not only is this one of the best films of the year, it is possibly one of the best films to come out of the '00's' Meryl Streep, though a little old for her part was as usual, on top form with an amazingly powerful and emotional voice. Her acting, whilst not on a par with The Devil Wears Prada, was excellent.;yes
Mamma Mia! (2008);6,5;A must-see for fans of ABBA;25.07.2008;If you're a fan of ABBA, then you need to see this movie. It's a love letter to the band, and it's full of their greatest hits. The cast is amazing, and the story is heartwarming. I would definitely recommend it.;yes
Mamma Mia! (2008);1;Disaster!;25.07.2008;it is one of the worst movies I've ever seen. Let me think... mm, nope, I'm wrong, it's the worst movie I've ever seen. Think about it, Streep singing and dancing, so Brosnan. (of course if you can consider those funny movements as dancing and awkward sounds as singing.) What can I say? Worst movie and except Amanda Seyfried and Colin Firth, worst cast ever.;no
Mamma Mia! (2008);1;If you want to listen to the music, go buy a CD!;25.07.2008;"My mother and I decided to watch this movie together. We both are ABBA fans and loved the ""Mamma Mia!"" musical. This movie is nothing like it. The one thing that got me was how much everyone seemed to over act. There was so much cheese in it that I wanted some wine, or maybe that was to get past the awful singing! Pierce Brosnan never needs to sing again. He just needs to stand and look pretty. I will respect him for that.";no
Mamma Mia! (2008);1;This is the one that almost got me divorced!!!;29.07.2008;"MY wife ( who never goes to movies) said lets go see Mamma Mia on our 15th wedding celebration and I unwittingly said yes. Now understand I love chick flicks like Sleepless, you've got mail etc. , but I was not prepared for this movie. I looked it up and saw comedy, Pierce Bronson etc and thought ""OH OK'. I will never trust PIERCE again and will read every review before saying OK again. I was in so much pain that a person behind us asked me to stop talking during the show and I was MOANING. Meryl Streep was SINGING. Pierce was screeching. The sound volume was so loud it hurt my ears ( I am hard of hearing) . The only cast member who belonged in this movie was Christine Baranski who kept it from 0.";no
Mamma Mia! (2008);6,5;A fun and frothy musical;30.07.2008;Mamma Mia! is a fun and frothy musical that is sure to please fans of ABBA. The cast is great, the songs are catchy, and the story is lighthearted. It's the perfect summer movie.;yes
Mamma Mia! (2008);3;Oh dear.........;31.07.2008;Just got back from an afternoon screening of this film. Even though the film has been showing for almost three weeks now, the cinema was PACKED with (mostly) over 50s. Firstly, I am a HUGE fan of ABBA (have been since the early 70s, even before their Eurovision win) and I so wanted to enjoy this film but I'm afraid that I felt like watching it with my hands covering my face and peeking through my fingers, such was my embarrassment! Overacted to the extreme by all concerned it is truly cringeworthy. The dreadful Julie Walters was the usual awful hammy, mugging Mrs. Overall persona that she always is (you may have guessed that I can't STAND this particular 'national treasure'.I really had to force myself to go to see it knowing that this ghastly woman was in it.) The music is actually tolerably sung by most of the cast (with the exception of Pierce Brosnan) but the 'OMG' hystrionics of the actors to show that they are having 'fun' is just appalling. Incidentally, not one person in the cinema laughed at the 'funny' bits. All in all, a miscast (the leads were WAY too old) misfire and one that any discerning cinema goer will find poor.;no
Mamma Mia! (2008);6,5;Feel-good movie of the year;01.08.2008;I have to admit, I'm not a huge fan of musicals, but I was pleasantly surprised by this one. The cast is great, the songs are catchy, and the story is heartwarming. It's the perfect movie to watch when you need a little pick-me-up.;yes
Mamma Mia! (2008);1;Painful !!!!!;02.08.2008;This is one of the worst films i have ever seen.;no
Mamma Mia! (2008);6;Lots of foot tapping;05.08.2008;We're seeing normally non-musical actors bursting into song and dance. It's just us. Meryl Streep has never seemed to be having so much fun as she does here. Brosnan, Firth, and Skarsgard also clearly relish the chance to do something they haven't done before. Amanda Seyfried. has always shown the kind of spark that suggests a star in the making. This is undoubtedly a breakthrough performance, as she brings charm, sweetness, and charisma to the role of Sophie.;yes
Mamma Mia! (2008);6;Pales in comparison to the stage production;07.08.2008;"I have seen Mama Mia twice on stage, and it is one of my favorite musicals, so I could barely wait to get to the theater to see it as a full feature film. Unfortunately, the movie was quite disappointing to say the least. I felt the casting of the characters was weak and poorly represented the characters as originally written. Donna was always portrayed as spunky and attractive though overworked and exhausted, and Meryl Streep just didn't have that ""umph"" to her. Pierce Brosnan had the look of Sam, but his singing was terrible. When adapting a musical to the big screen, quality of singing voice should be given more consideration. There are so many amazing actors with phenomenal voices, I can't understand why they didn't cast a little more carefully. There were also songs from the stage production that were not included in the movie including my favorite, ""Thank you for the Music"". I kept waiting for it to be thrown in somewhere along the way, but it was not included at all. While I wouldn't say the movie was terrible, I think if you have seen it live on stage, prepare to be disappointed.";yes
